{"schema_version":1,"package":{"agent":{"id":"acme-agent","name":"Acme","version":"1.0.0","description":"Agent","license":"MIT","repository":"https://github.com/acme/provider","distribution":{"binary":{"darwin-aarch64":{"archive":"https://github.com/acme/provider/releases/download/v1/a0.tgz","cmd":"bin/provider","sha256":"7692c3ad3540bb803c020b3aee66cd8887123234ea0c6e7143c0add73ff431ed"},"linux-x86_64":{"archive":"https://github.com/acme/provider/releases/download/v1/a1.tgz","cmd":"bin/provider","sha256":"3fc4ccfe745870e2c0d99f71f30ff0656c8dedd41cc1d7d3d376b0dbe685e2f3"}}}},"host":{"publisher":"acme","compatibility":{"min_app_version":"0.12.0"},"assets":{"icon":"icon.svg","readme":"README.md","license":"LICENSE"}}},"source":{"repository":"https://github.com/acme/provider","commit":"aaaaaaaaaaaaaaaaaaaaaaaaaaaaaaaaaaaaaaaa","tag":"v1"},"changelog":"Release"}
